id,drafted,hs,col
aardsda01,True,"Cherry Creek HS (Greenwood Village, CO)","Pennsylvania State University (State College, PA)"
abadan01,True,"Jupiter HS (Jupiter, FL)","Middle Georgia College (Cochran, GA)"
abadfe01,False,,
abercre01,True,"Columbus HS (Columbus, GA)","Florida Gateway College (Lake City, FL)"
abernbr01,False,"Lovett School (Atlanta, GA)",Toronto Blue Jays
abreujo02,False,,
abreuju01,False,,
abreuto01,False,,
abreuwi01,False,,
accarje01,False,"Mesa HS (Mesa, AZ)","Illinois State University (Normal, IL)"
aceveal01,False,,
acevejo01,False,"Santiago (Santiago, Dominican Republic)",
achteaj01,True,"Clay HS (Oregon, OH)","Michigan State University (East Lansing, MI)"
ackledu01,True,"North Forsyth HS (Winston-Salem, NC)","University of North Carolina at Chapel Hill (Chapel Hill, NC)"
acostma01,False,,
acunaro01,False,,
adamecr01,False,,
adamewi01,False,,
adamja01,True,"Blue Valley Northwest HS (Overland Park, KS)",
adamsau01,True,"Stanhope Elmore HS (Millbrook, AL)","Faulkner University (Montgomery, AL)"
adamsau02,True,"Zephyrhills HS (Zephyrhills, FL)","University of South Florida (Tampa, FL)"
adamsch01,True,"Chaparral HS (Scottsdale, AZ)","Dallas Baptist University (Dallas, TX)"
adamsda02,True,"Grandview Prep (Boca Raton, FL)","University of Virginia (Charlottesville, VA)"
adamsla01,True,"Red Oak HS (Red Oak, OK)",
adamsma01,True,"Philipsburg-Osceola HS (Philipsburg, PA)","Slippery Rock University of Pennsylvania (Slippery Rock, PA)"
adamsmi03,False,"Sinton HS (Sinton, TX)","Texas A&M University-Kingsville (Kingsville, TX)"
adamsru01,True,"Scotland HS (Laurinburg, NC)","University of North Carolina at Chapel Hill (Chapel Hill, NC)"
adamsry01,True,"Jesuit HS (New Orleans, LA)",
adcocna01,True,"North Hardin HS (Radcliff, KY)",
adducji02,True,"Evergreen Park HS (Evergreen Park, IL)",
adenhni01,True,"Williamsport HS (Williamsport, MD)",
adkinjo01,True,"Wayne HS (Wayne, WV)","Oklahoma State University (Stillwater, OK)"
adlemti01,True,"Wakefield HS (Raleigh, NC)","Georgetown University (Washington, DC)"
adriaeh01,False,,
affelje01,True,"Northwest Christian HS (Spokane, WA)",
aguilch01,True,"McQueen HS (Reno, NV)",
aguilje01,False,,
ahmedni01,True,"East Longmeadow HS (East Longmeadow, MA)","University of Connecticut (Storrs, CT)"
ainswku01,True,"Catholic HS (Baton Rouge, LA)","Louisiana State University (Baton Rouge, LA)"
albaljo01,True,"Colegio Janil (Vega Baja, Puerto Rico)","Miami-Dade College (Miami, FL)"
alberan01,True,"John Paul II HS (North Battleford, SK)","University of Kentucky (Lexington, KY)"
alberha01,False,,
alberma01,True,"William P. Clements HS (Sugar Land, TX)","San Jacinto College (Pasadena, TX)"
albieoz01,False,,
albural01,False,,
alcanar01,False,,
alcanis01,False,"Santo Domingo (Santo Domingo, Dominican Republic)",
alcanra01,False,,
alcansa01,False,,
alcanvi01,False,,
aldrico01,True,"Cooper HS (Abilene, TX)",
alexasc02,True,"Cardinal Newman HS (Santa Rosa, CA)","Sonoma State University (Rohnert Park, CA)"
alfarja01,True,"Western Hills HS (Fort Worth, TX)","Hill College (Hillsboro, TX)"
alfarjo01,False,,
alfonel01,False,"Puerto la Cruz (Puerto la Cruz, Venezuela)",
alforan01,True,"Petal HS (Petal, MS)","University of Mississippi (Oxford, MS)"
allarko01,True,"San Clemente HS (San Clemente, CA)",
allenbr01,True,"Montgomery HS (Montgomery, TX)",
allenco01,True,"William R. Boone HS (Orlando, FL)","High Point University (High Point, NC)"
allendu01,True,"Edmond Memorial HS (Edmond, OK)","Stanford University (Palo Alto, CA)"
allengr01,True,"Hilltop HS (Chula Vista, CA)","San Diego State University (San Diego, CA)"
allenlu01,False,"Newton HS (Covington, GA)",
almonab01,False,,
almoned01,True,"Seward Park HS (Seward Park, NY)","St. Francis University (Brooklyn, NY)"
almoner01,False,"Santo Domingo (Santo Domingo, Dominican Republic)",
almonmi01,False,,
almonye01,True,"Christopher Columbus HS (Miami, FL)",
almonzo01,False,,
almoral01,False,"Mater Academy Charter School (Hialeah, FL)",Chicago Cubs
alonsyo01,True,"Coral Gables HS (Coral Gables, FL)","University of Miami (Coral Gables, FL)"
altavda01,True,"Elizabeth-Forward HS (McKeesport, PA)","Mercyhurst College (Erie, PA)"
altheaa01,True,"Agua Fria HS (Avondale, AZ)",
altuvjo01,False,,
alvarab01,True,"Fontana HS (Fontana, CA)","California State University Long Beach (Long Beach, CA)"
alvarcl01,False,"Anzoategui (Anzoategui, Venezuela)",
alvarda01,False,Liceo Herminia Perez (Dominican Republic),
alvarda02,False,,
alvarhe01,False,,
alvarjo02,False,,
alvarjo03,False,,
alvarpe01,False,"Horace Mann School (Riverdale, NY)","Vanderbilt University (Nashville, TN)"
alvarrj01,True,"Cardinal Newman HS (West Palm Beach, FL)","Florida Atlantic University (Boca Raton, FL)"
alvarto01,False,"Los Teques (Los Teques, Venezuela)",
alvarvi01,False,"Culiacan (Culiacan, Mexico)",
amarial01,False,,
ambrech01,True,"Beaumont HS (Beaumont, TX)",
ambrihe01,True,"Valencia HS (Placentia, CA)","University of California, Los Angeles (Los Angeles, CA)"
amesst01,True,"Hudson's Bay HS (Vancouver, WA)","Gonzaga University (Spokane, WA)"
amezaal01,True,"Miami Senior HS (Miami, FL)","St. Petersburg College (St. Petersburg, FL)"
anderbr03,True,"Canyon del Oro HS (Oro Valley, AZ)","University of Arizona (Tucson, AZ)"
anderbr04,True,"Stillwater HS (Stillwater, OK)",
anderbr05,True,"Simi Valley HS (Simi Valley, CA)",
anderbr06,True,"Deer Creek HS (Edmond, OK)","University of Arkansas (Fayetteville, AR)"
anderch01,True,"Rider HS (Wichita Falls, TX)","University of Oklahoma (Norman, OK)"
anderco01,True,"Quincy HS (Quincy, CA)","Feather River College (Quincy, CA)"
anderdr01,True,"Kearney HS (Kearney, NE)","University of Nebraska at Lincoln (Lincoln, NE)"
anderdr02,True,"Galena HS (Reno, NV)",
anderja01,True,"Danville HS (Danville, IL)","University of Illinois at Urbana-Champaign (Champaign, IL)"
anderjo03,True,"Pulaski County HS (Somerset, KY)","Eastern Kentucky University (Richmond, KY)"
anderju01,True,"St. Pius X HS (Houston, TX)","University of Texas at San Antonio (San Antonio, TX)"
anderla03,True,"Jesuit HS (Carmichael, CA)",
anderta01,True,,"Harvard University (Cambridge, MA)"
anderti01,True,"Hillcrest HS (Tuscaloosa, AL)","East Central Community College (Decatur, MS)"
anderty01,True,"Valley HS (Las Vegas, NV)","University of Oregon (Eugene, OR)"
andinro01,True,"Miami Southridge Senior HS (Miami, FL)",
andrast01,True,"Woodland HS (Woodland, CA)","American River College (Sacramento, CA)"
andrecl01,True,"Seminole HS (Seminole, FL)",
andrejo03,True,"St. John's HS (Shrewsbury, MA)","University of Connecticut (Storrs, CT)"
andrima01,True,"Redlands East Valley HS (Redlands, CA)","University of California, Riverside (Riverside, CA)"
andruel01,False,,
andujmi01,False,,
anglema01,True,"Whitehall-Yearling HS (Whitehall, OH)","The Ohio State University (Columbus, OH)"
annade01,True,"Lincoln-Way East HS (Frankfort, IL)","Ball State University (Muncie, IN)"
antoldu01,True,"Mililani HS (Mililani, HI)",
antonma01,False,"St. John's Preparatory School (Danvers, MA)","Wake Forest University (Winston-Salem, NC)"
aokino01,False,Hyuga HS (Japan),Waseda University (Japan)
aquinar01,False,,
aquingr01,False,"Americo Lugo (Palenque, Dominican Republic)",
aquinja01,False,,
aranovi01,False,,
araujel01,False,,
araujpe01,False,,
archech01,True,"Clayton HS (Clayton, NC)",
arciafr01,False,,
arciaor01,False,,
arciaos01,False,,
ardoida01,True,"Sacred Heart HS (Villa Platte, LA)","Texarkana College (Texarkana, TX)"
arenano01,True,"El Toro HS (Lake Forest, CA)",
arencjp01,True,"Westminster Christian (Miami, FL)","University of Tennessee (Knoxville, TN)"
ariasal02,False,,
ariasjo01,False,,
armstsh01,True,"West Craven HS (Vanceboro, NC)","East Carolina University (Greenville, NC)"
arojo01,False,,
arredjo01,False,Ava Josefa Puello (Dominican Republic),
arrieja01,True,"Plano East HS (Plano, TX)","Texas Christian University (Fort Worth, TX)"
arroybr01,True,"Hernando HS (Brooksville, FL)",
arroych01,True,"Hernando HS (Brooksville, FL)",
arrueba01,False,,
ascanjo01,False,,
ascheco01,True,"Fort Zumwalt West HS (O'Fallon, MO)","University of Nebraska at Lincoln (Lincoln, NE)"
asencmi01,False,"Liceo Tiro Al Blanco (La Victoria, Dominican Republic)",
asheral01,True,"Lakeland Senior HS (Lakeland, FL)","Polk Community College (Winter Haven, FL)"
ashlene01,True,"North Knox HS (Bicknell, IN)","Indiana State University (Terre Haute, IN)"
astacez01,False,"Hato Mayor (Hato Mayor, Dominican Republic)",
astinba01,True,"Forrest City HS (Forrest City, AR)","University of Arkansas (Fayetteville, AR)"
astudwi01,False,,
asuajca01,True,"St. Thomas Aquinas HS (Fort Lauderdale, FL)","Nova Southeastern University (Fort Lauderdale, FL)"
atchisc01,True,"McCullough HS (The Woodlands, TX)","Texas Christian University (Fort Worth, TX)"
atchlju01,True,"Sedro-Woolley HS (Sedro-Woolley, WA)","Walla Walla Community College (Walla Walla, WA)"
atilalu01,True,"Gabriela Mistral (Lares, Puerto Rico)",
atkinga01,True,"University HS (Irvine, CA)","University of California, Los Angeles (Los Angeles, CA)"
atkinmi01,True,"Northeast Guilford HS (McLeansville, NC)",
aubremi01,True,"Southwood HS (Shreveport, LA)","Tulane University (New Orleans, LA)"
augenbr01,True,"Sebastian River HS (Sebastian, FL)","University of Florida (Gainesville, FL)"
aumonph01,True,"Ecole Du Versant (Gatineau, QC)",
austije01,True,"Kingwood HS (Kingwood, TX)","Stanford University (Palo Alto, CA)"
austity01,True,"Heritage HS (Conyers, GA)",
aveliab01,False,,
averyxa01,True,"Cedar Grove HS (Ellenwood, GA)",
avilaal01,True,"Archbishop McCarthy HS (Southwest Ranches, FL)","University of Alabama (Tuscaloosa, AL)"
avilalu01,False,,
avilemi01,True,"Middletown HS (Middletown, NY)","Concordia College-Bronxville (Bronxville, NY)"
axelrdy01,True,"Santa Barbara HS (Santa Barbara, CA)","University of California, Irvine (Irvine, CA)"
axforjo01,False,"Assumption College School (Brantford, ON)","Canisius College (Buffalo, NY)"
ayalalu01,False,"Los Mochis (Los Mochis, Mexico)",
aybarer01,False,"Freddie Pimental (Freddie Pimental, Dominican Republic)",
aybarwi01,False,,
backebr01,True,"Ball HS (Galveston, TX)","Galveston College (Galveston, TX)"
bacsimi02,True,"Duncanville HS (Duncanville, TX)",
badenbu01,True,"Perrysburg HS (Perrysburg, OH)","Bowling Green State University (Bowling Green, OH)"
baderha01,True,"Horace Mann School (Riverdale, NY)","University of Florida (Gainesville, FL)"
baekch01,False,"Pusan (Pusan, South Korea)",
baezbe01,False,"Bonao (Bonao, Dominican Republic)",
baezda01,False,"Pinar del Rio (Pinar del Rio, Cuba)",
baezja01,False,"Arlington Country Day School (Jacksonville, FL)",Chicago Cubs
baezpe01,False,,
baezsa01,False,,
bailean01,True,"Paul VI HS (Haddonfield, NJ)","Wagner College (Staten Island, NY)"
baileho02,True,"La Grange HS (La Grange, TX)",
baileje01,True,"Kelso HS (Kelso, WA)",
baislje01,True,"Land O'Lakes HS (Land O'Lakes, FL)","University of South Florida (Tampa, FL)"
bajenje01,True,"Senator Ruben S. Ayala HS (Chino Hills, CA)","Riverside Community College (Riverside, CA)"
bakerje03,True,"Garfield HS (Woodbridge, VA)","Clemson University (Clemson, SC)"
bakerjo01,True,"De La Salle HS (Concord, CA)","University of California, Berkeley (Berkeley, CA)"
bakersc02,True,"Captain Shreve HS (Shreveport, LA)","Oklahoma State University (Stillwater, OK)"
baldero01,True,"Bishop Hendricken HS (Warwick, RI)",
balenwl01,False,,
balesco01,True,"Huntington Beach HS (Huntington Beach, CA)",
balfogr01,False,"Glenwood (Glenwood, Australia)",
bandaan01,True,"Sinton HS (Sinton, TX)","San Jacinto College, North Campus (Houston, TX)"
bandyje01,True,"Thousand Oaks HS (Thousand Oaks, CA)","University of Arizona (Tucson, AZ)"
banksjo01,True,"Severna Park HS (Severna Park, MD)","Florida International University (Miami, FL)"
bankswe01,True,"Plano East HS (Plano, TX)",
bannibr01,True,"Chaparral HS (Scottsdale, AZ)","University of Southern California (Los Angeles, CA)"
bantzbr01,True,"Mansfield HS (Mansfield, TX)","Dallas Baptist University (Dallas, TX)"
banuema01,False,,
barbajo01,True,"Felix Varela HS (Miami, FL)",
barcelo01,False,"San Pedro de Macoris (San Pedro de Macoris, Dominican Republic)",
bardda01,True,"Charlotte Christian HS (Charlotte, NC)","University of North Carolina at Chapel Hill (Chapel Hill, NC)"
bardebr01,True,"St. Augustine HS (San Diego, CA)","Oregon State University (Corvallis, OR)"
bardjo01,True,"Cherry Creek HS (Greenwood Village, CO)","Texas Tech University (Lubbock, TX)"
bardlu01,True,"Charlotte Christian HS (Charlotte, NC)","Georgia Institute of Technology (Atlanta, GA)"
barfijo02,True,"Spring HS (Spring, TX)",
barkean01,False,"Killian HS (Miami, FL)","North Carolina State University (Raleigh, NC)"
barkese01,True,"Stockdale HS (Bakersfield, CA)","Bakersfield College (Bakersfield, CA)"
barlosc01,True,"Golden Valley HS (Santa Clarita, CA)",
barmecl01,True,"Vincennes Lincoln HS (Vincennes, IN)","Olney Central College (Olney, IL)"
barneau01,True,"Riverside Poly HS (Riverside, CA)","Arizona State University (Tempe, AZ)"
barnebr02,True,"Katella HS (Anaheim, CA)","Cypress College (Cypress, CA)"
barneda01,True,"Southridge HS (Beaverton, OR)","Oregon State University (Corvallis, OR)"
barneda02,True,"Manhasset HS (Manhasset, NY)","Princeton University (Princeton, NJ)"
barneja01,True,"St. Petersburg HS (St. Petersburg, FL)","Florida Gulf Coast University (Fort Myers, FL)"
barnejo01,True,"Granite Hills HS (El Cajon, CA)","Grossmont College (El Cajon, CA)"
barnela01,True,"Bakersfield HS (Bakersfield, CA)","Bakersfield College (Bakersfield, CA)"
barnema01,True,"Bethel HS (Bethel, CT)","University of Connecticut (Storrs, CT)"
barnesc01,True,"Our Lady of Hope Cathedral HS (Springfield, MA)","St. John's University (Queens, NY)"
barneto01,True,"Thomas Jefferson HS (Auburn, WA)","Arizona State University (Tempe, AZ)"
barnhtu01,True,"Brownsburg HS (Brownsburg, IN)",
barnwch01,True,"Allen D. Nease HS (Ponte Vedra Beach, FL)","Flagler College (St. Augustine, FL)"
baronda01,True,"San Benito HS (Hollister, CA)","Monterey Peninsula College (Monterey, CA)"
baronst01,False,"John A. Ferguson School (Miami, FL)",Seattle Mariners
barraky01,True,"Wilcox HS (Santa Clara, CA)","St. Mary's College of California (Moraga, CA)"
barreaa01,True,"Central HS (Evansville, IN)","University of Mississippi (Oxford, MS)"
barrefr02,False,,
barreja01,True,"Desert Ridge HS (Mesa, AZ)","Arizona State University (Tempe, AZ)"
barrija01,False,,
barriyh01,False,,
barryke01,True,"West Windsor-Plainsboro HS (Princeton Junction, NJ)","Rider University (Lawrenceville, NJ)"
barthji01,True,"Roswell HS (Roswell, GA)",
bartlja01,True,"St. Mary's HS (St. Mary's, CA)","San Joaquin Delta College (Stockton, CA)"
bartobr01,True,"Westchester HS (Los Angeles, CA)","Loyola Marymount University (Los Angeles, CA)"
bartocl01,True,"Duncanville HS (Duncanville, TX)",
bartoda02,True,"Huntington Beach HS (Huntington Beach, CA)",
barziph01,True,"Dulles HS (Sugar Land, TX)","Alvin Community College (Alvin, TX)"
basakch01,True,"Minooka HS (Minooka, IL)","University of Illinois at Urbana-Champaign (Champaign, IL)"
bashlty01,True,"Calvary Day Baptist (Savannah, GA)","South Georgia College (Douglas, GA)"
bassan01,True,"Trenton HS (Trenton, MI)","Wayne State University (Detroit, MI)"
bassbr01,True,"Lee HS (Montgomery, AL)",
bassich01,True,"Genoa Area HS (Clay, OH)","University of Akron (Akron, OH)"
bastaan01,False,"Liceo Sol Ana Nolan (San Pedro de Macoris, Dominican Republic)",
batesaa01,True,"Archbishop Mitty HS (San Jose, CA)","San Jose State University (San Jose, CA)"
bauerja01,True,"Marina HS (Huntington Beach, CA)",
bauerri01,True,"Centennial HS (Eagle, ID)","Treasure Valley Community College (Ontario, OR)"
bauertr01,True,"William S. Hart HS (Santa Clarita, CA)","University of California, Los Angeles (Los Angeles, CA)"
baumabu01,True,"Logan-Rogersville HS (Rogersville, MO)","Missouri State University (Springfield, MO)"
bautide01,False,Liceo Las Americas (Dominican Republic),
bautige01,False,,
bautijo02,True,"De La Salle (Santo Domingo, Dominican Republic)","Chipola College (Marianna, FL)"
bautira01,False,,
baxtemi01,True,"Archbishop Molloy HS (Queens, NY)","Columbia University (New York, NY)"
bayja01,True,"J. Lloyd Crow HS (Trail, BC)","North Idaho College (Coeur d'Alene, ID)"
baylijo01,True,"Lawrence Academy (Groton, MA)","Trinity College (Hartford, CT)"
bazaryo01,False,,
beachbr01,False,"Northwestern HS (Kokomo, IN)","Indiana Wesleyan University (Marion, IN)"
beamtj01,True,"Saguaro HS (Scottsdale, AZ)","Scottsdale Community College (Scottsdale, AZ)"
beanco01,False,"Vestavia Hills HS (Vestavia Hills, AL)","Auburn University (Auburn, AL)"
beatope01,True,"Xaverian HS (Brooklyn, NY)","St. Petersburg College (St. Petersburg, FL)"
beavabl01,True,"Irving HS (Irving, TX)",
bechlst01,True,"South HS (Medford, OR)",
beckch01,True,"Woodville HS (Woodville, TX)","University of Louisiana at Lafayette (Lafayette, LA)"
beckch02,True,"Jefferson HS (Jefferson, GA)","Georgia Southern University (Statesboro, GA)"
beckejo02,True,"Spring HS (Spring, TX)",
beckhgo01,True,"Westminster HS (Atlanta, GA)","University of Georgia (Athens, GA)"
beckhti01,True,"Griffin HS (Griffin, GA)",
bedarer01,True,"Norwalk HS (Norwalk, CT)","Norwalk Community College (Norwalk, CT)"
bedroca01,True,"East Coweta HS (Sharpsburg, GA)",
beedety01,True,"Lawrence Academy (Groton, MA)","Vanderbilt University (Nashville, TN)"
beeksja02,True,"Prairie Grove HS (Prairie Grove, AR)","University of Arkansas (Fayetteville, AR)"
beeleda01,True,"Jenks HS (Jenks, OK)","Oral Roberts University (Tulsa, OK)"
beimejo01,True,"St. Mary's HS (St. Mary's, PA)","Duquesne University (Pittsburgh, PA)"
beirnke01,True,"McCollough HS (The Woodlands, TX)","Texas A&M University (College Station, TX)"
belfimi01,True,"Commack HS (Commack, NY)","Boston College (Chestnut Hill, MA)"
belisma01,True,"McCallum HS (Austin, TX)",
belisro01,False,"Augusto Mijares (Maracay, Venezuela)",
belitto01,True,"Edison HS (Huntington Beach, CA)","Washington State University (Pullman, WA)"
belivje01,True,"Bishop Hendricken HS (Warwick, RI)","College of Charleston (Charleston, SC)"
bellaan01,True,"Steele Canyon HS (Spring Valley, CA)",
bellch02,True,"South Doyle HS (Knoxville, TN)","Walters State Community College (Morristown, TN)"
bellhe01,True,"Tustin HS (Tustin, CA)","Rancho Santiago College (Santa Ana, CA)"
bellico01,True,"Hamilton HS (Chandler, AZ)",
belljo01,True,"Santaluces Community HS (Lantana, FL)",
belljo02,True,"Dallas Jesuit College Prep (Dallas, TX)",
bellmi02,True,"Archbishop Moeller HS (Cincinnati, OH)",
belloed01,False,,
bellro01,True,"Central HS (Marlboro, NY)",
belltr01,True,"Crescenta Valley HS (La Crescenta, CA)",
belnovi01,True,"Coatesville HS (Coatesville, PA)","West Virginia University (Morgantown, WV)"
belowdu01,True,"Britton-Macon HS (Britton, MI)","Lake Michigan College (Benton Harbor, MI)"
beltbr01,True,"Hudson HS (Lufkin, TX)","San Jacinto College, North Campus (Houston, TX)"
beltren01,False,,
beltrfr01,False,"Santo Domingo (Santo Domingo, Dominican Republic)",
beltrom01,False,,
beninan01,True,"Madeira HS (Cincinnati, OH)","University of Arkansas (Fayetteville, AR)"
benneje01,True,"Gordonsville HS (Gordonsville, TN)",
benoijo01,False,"Santiago (Santiago, Dominican Republic)",
bensojo01,True,"Joliet Catholic Academy (Joliet, IL)",
bentzch01,True,"Douglas HS (Juneau, AK)","California State University Long Beach (Long Beach, CA)"
beresja01,False,"Wesley College (Melbourne, Australia)",
bergebr01,True,"Beechwood HS (Fort Mitchell, KY)","Eastern Kentucky University (Richmond, KY)"
bergebr02,True,"Foothill HS (Pleasanton, CA)",
bergju01,True,"Antigo HS (Antigo, WI)","Indian Hills Community College (Centerville, IA)"
bergmch01,True,"St. Francis HS (La Canada, CA)","University of California, Irvine (Irvine, CA)"
bergmdu01,True,"Carson HS (Carson City, NV)","University of Hawaii at Manoa (Honolulu, HI)"
bergmja01,True,"Manalapan HS (Englishtown, NJ)","Rutgers, the State University of New Jersey (New Brunswick, NJ)"
bergowi01,False,"Valencia (Valencia, Venezuela)",
berkeja01,True,"West De Pere HS (De Pere, WI)","Clemson University (Clemson, SC)"
bernaro01,False,"Voorben Praktyk (Willemstad, Curacao)",
bernead01,True,"John F. Kennedy HS (Sacramento, CA)","Culver-Stockton College (Canton, MO)"
bernido01,False,"St. Joseph HS (Santa Maria, CA)","Cuesta College (San Luis Obispo, CA)"
berrijo01,True,"Papa Juan HS (Bayamon, Puerto Rico)",
berroan01,False,"Santo Domingo (Santo Domingo, Dominican Republic)",
berryqu01,True,"Samuel F. B. Morse HS (San Diego, CA)","Grossmont College (El Cajon, CA)"
bertijo01,True,"Troy HS (Troy, MI)","Bowling Green State University (Bowling Green, OH)"
betande01,True,"Grand Street Campus HS (Brooklyn, NY)",
betanra01,False,,
betanyu01,False,,
betemwi01,False,"Santo Domingo (Santo Domingo, Dominican Republic)",
bethach01,False,,
bettich01,True,"Monterey HS (Lubbock, TX)","Texas Tech University (Lubbock, TX)"
bettsmo01,True,"Overton HS (Nashville, TN)",
beverja01,True,"Dondero HS (Royal Oak, MI)","Western Carolina University (Cullowhee, NC)"
biagijo01,True,"The King's Academy (Sunnyvale, CA)","University of California, Davis (Davis, CA)"
biancje01,True,"Lampeter HS (Lampeter, PA)",
bibenau01,True,"McNary HS (Keizer, OR)","University of Portland (Portland, OR)"
biddlje01,True,,
biddlro01,True,"Temple City HS (Temple City, CA)","California State University Long Beach (Long Beach, CA)"
biebesh01,True,"Laguna Hills HS (Laguna Hills, CA)","University of California, Santa Barbara (Santa Barbara, CA)"
bierbni01,True,"Millikan HS (Long Beach, CA)",
bierdra01,False,,
bigbila01,True,"Hobart HS (Hobart, IN)","Ball State University (Muncie, IN)"
billibr02,True,"Samuel F. B. Morse HS (San Diego, CA)","San Diego State University (San Diego, CA)"
billich01,True,"Defiance HS (Defiance, OH)",
birdgr01,True,"Grandview HS (Aurora, CO)",
birkiku01,True,"El Camino Real HS (Woodland Hills, CA)","Los Angeles Pierce College (Woodland Hills, CA)"
bisenjo01,True,"Bishop Heelan HS (Sioux City, IA)","Iowa Western Community College (Council Bluffs, IA)"
bixlebr01,True,"Perkins HS (Sandusky, OH)","Eastern Michigan University (Ypsilanti, MI)"
blachty01,True,"Regis Jesuit HS (Aurora, CO)","Creighton University (Omaha, NE)"
blackch02,True,"North Gwinnett HS (Suwanee, GA)","Georgia Institute of Technology (Atlanta, GA)"
blackni01,True,"Del City HS (Del City, OK)","Seminole State College (Seminole, OK)"
blackpa01,True,"Heritage HS (Brentwood, CA)",
blackra01,True,"James M. Coughlin HS (Wilkes-Barre, PA)","University of Pittsburgh (Pittsburgh, PA)"
blacktr01,False,"Cheltenham Secondary College (Cheltenham, Australia)",
blackvi01,True,"Amarillo HS (Amarillo, TX)","Dallas Baptist University (Dallas, TX)"
blairaa01,True,"Spring Valley HS (Las Vegas, NV)","Marshall University (Huntington, WV)"
blairca01,False,"Liberty Christian School (Argyle, TX)",Boston Red Sox
blaloha01,True,"Rancho Bernardo HS (San Diego, CA)",
blancan01,False,El Carmen (Venezuela),
blancgr01,False,"Ignacio Martin Burk HS (Valera, Venezuela)",
blancto01,False,"Haina (Haina, Dominican Republic)",
blandal01,True,"St. Francis HS (Mountain View, CA)","Stanford University (Palo Alto, CA)"
blandna01,True,"Mountain Brook HS (Mountain Brook, AL)",
blankky01,True,"Moriarty HS (Moriarty, NM)","Yavapai College (Prescott, AZ)"
blankma01,True,"James W. Martin HS (Arlington, TX)","Texas A&M University (College Station, TX)"
blantjo01,True,"Franklin-Simpson HS (Franklin, KY)","University of Kentucky (Lexington, KY)"
blashja01,True,"Charlotte Amalie HS (St. Thomas, U. S. Virgin Islands)","Miami-Dade College, Wolfson Campus (Miami, FL)"
blazemi01,True,"Arbor View HS (Las Vegas, NV)",
bleicje01,True,,"Stanford University (Palo Alto, CA)"
bleieri01,True,"South Plantation HS (Plantation, FL)","Florida Gulf Coast University (Fort Myers, FL)"
blevije01,True,"Arcadia HS (Arcadia, OH)","University of Dayton (Dayton, OH)"
bloomwi01,True,"South Kitsap HS (Port Orchard, WA)","Arizona State University (Tempe, AZ)"
bocachi01,True,"Bayamon (Bayamon, Puerto Rico)",
bochybr02,True,"Poway HS (Poway, CA)","University of Kansas (Lawrence, KS)"
bococbr01,True,"Turner-Ashby HS (Bridgewater, VA)","Stetson University (DeLand, FL)"
boescbr01,True,"Harvard-Westlake HS (Los Angeles, CA)","University of California, Berkeley (Berkeley, CA)"
bogaexa01,False,Colegio Arubano (Aruba),
boggsbr01,True,"Pope HS (Marietta, GA)","Georgia Institute of Technology (Atlanta, GA)"
boggsmi01,True,"Dalton HS (Dalton, GA)","University of Georgia (Athens, GA)"
bogusbr01,True,"De La Salle Insitute (Chicago, IL)","Tulane University (New Orleans, LA)"
bohntj01,True,"St. Louis Park HS (St. Louis Park, MN)","Hutchinson Community College (Hutchinson, KS)"
bolsimi01,True,"McKinney North HS (McKinney, TX)","University of Arkansas (Fayetteville, AR)"
bondeje01,True,"Pasco HS (Pasco, WA)",
bongju01,False,"Sin Il (Seoul, South Korea)",
bonifem01,False,"Enma Balaguer (Santo Domingo, Dominican Republic)",
bonifjo01,False,,
bonilli01,False,,
bonined01,True,"Mountain Ridge HS (Glendale, AZ)","Glendale Community College (Glendale, CA)"
bonsebo01,True,"Gibbs HS (St. Petersburg, FL)",
bookech01,True,"Monroeville HS (Monroeville, AL)",
bootcch01,True,"LaPorte HS (LaPorte, IN)","Auburn University (Auburn, AL)"
borboju01,True,"De La Salle (Santo Domingo, Dominican Republic)","University of Tennessee (Knoxville, TN)"
borchjo01,True,"Adolfo Camarillo HS (Camarillo, CA)","Stanford University (Palo Alto, CA)"
bormajo01,True,,"University of Texas at San Antonio (San Antonio, TX)"
borucry01,True,"Mundelein HS (Mundelein, IL)",
boscajc01,False,"Nuestra Senora del Fatima (Maracaibo, Venezuela)",
boscawi01,False,,
boshebu01,True,"Lee HS (Huntsville, AL)","Calhoun Community College (Decatur, AL)"
bostich01,True,"Aquinas Institute (Rochester, NY)",
boteda01,True,"Faith Christian Academy (Arvada, CO)","Neosho County Community College (Chanute, KS)"
bottsja01,True,"Paso Robles HS (Paso Robles, CA)","Glendale Community College (Glendale, CA)"
